{
  "name": "simplifier",
  "description": "Code simplification and refactoring for clarity & maintainability",
  "version": "3.1.0",
  "author": {
    "name": "Pamacea",
    "email": "[emailÂ protected]"
  },
  "homepage": "https://github.com/Pamacea/smite/tree/main/plugins/simplifier",
  "repository": "https://github.com/Pamacea/smite",
  "license": "MIT",
  "keywords": ["refactoring", "simplification", "cleanup", "maintainability"],
  "commands": "./commands/",
  "skills": "./skills/"
}
