{
  "name": "basics",
  "description": "Essential Claude commands for rapid development - oneshot, explore, debug, commit, claude-memory, and more",
  "version": "3.5.0",
  "author": {
    "name": "Pamacea",
    "email": "[emailÂ protected]"
  },
  "homepage": "https://github.com/Pamacea/smite/tree/main/plugins/basics",
  "repository": "https://github.com/Pamacea/smite",
  "license": "MIT",
  "keywords": ["development", "commands", "workflow", "git", "documentation"],
  "commands": "./commands/",
  "skills": "./skills/",
  "hooks": {
    "SessionStart": [
      {
        "hooks": [
          {
            "type": "command",
            "command": "node ${CLAUDE_PLUGIN_ROOT}/hooks/install.js"
          }
        ]
      }
    ]
  }
}
