{
  "name": "explorer",
  "description": "Codebase exploration, dependency mapping & pattern discovery",
  "version": "3.1.0",
  "author": {
    "name": "Pamacea",
    "email": "[emailÂ protected]"
  },
  "homepage": "https://github.com/Pamacea/smite/tree/main/plugins/explorer",
  "repository": "https://github.com/Pamacea/smite",
  "license": "MIT",
  "keywords": ["exploration", "dependencies", "patterns", "architecture", "analysis"],
  "commands": "./commands/",
  "skills": "./skills/"
}
