{
  "name": "quality-gate",
  "description": "Automated code review (complexity, security, semantics)",
  "version": "3.1.0",
  "author": {
    "name": "Pamacea",
    "email": "[emailÂ protected]"
  },
  "homepage": "https://github.com/Pamacea/smite/tree/main/plugins/quality-gate",
  "repository": "https://github.com/Pamacea/smite",
  "license": "MIT",
  "keywords": ["quality", "validation", "review", "security", "complexity"],
  "commands": "./commands/",
  "skills": "./skills/"
}
