{
  "name": "finalize",
  "description": "QA & documentation agent (test + review + lint + docs)",
  "version": "3.1.0",
  "author": {
    "name": "Pamacea",
    "email": "[emailÂ protected]"
  },
  "homepage": "https://github.com/Pamacea/smite/tree/main/plugins/finalize",
  "repository": "https://github.com/Pamacea/smite",
  "license": "MIT",
  "keywords": ["qa", "testing", "review", "documentation", "linting"],
  "commands": "./commands/",
  "skills": "./skills/"
}
