{
  "name": "builder",
  "description": "Implementation agent with tech specialization (Next.js, Rust, Python)",
  "version": "3.1.0",
  "author": {
    "name": "Pamacea",
    "email": "[emailÂ protected]"
  },
  "homepage": "https://github.com/Pamacea/smite/tree/main/plugins/builder",
  "repository": "https://github.com/Pamacea/smite",
  "license": "MIT",
  "keywords": ["implementation", "coding", "constructor", "nextjs", "rust", "python"],
  "commands": "./commands/",
  "skills": "./skills/"
}
