{
  "name": "shell",
  "description": "Cross-platform shell aliases for Claude Code (cc and ccc)",
  "version": "3.1.0",
  "author": {
    "name": "Pamacea",
    "email": "[emailÂ protected]"
  },
  "homepage": "https://github.com/Pamacea/smite/tree/main/plugins/shell",
  "repository": "https://github.com/Pamacea/smite",
  "license": "MIT",
  "keywords": ["shell", "aliases", "cli", "cross-platform", "productivity"],
  "commands": "./commands/"
}
